No,Quality_Score,Quality_Grade,Keyword,Title,Description,Link,Date,Source,Language
1,51.00,C-,zhafran terbaru,Jual Zhafran Terlengkap & Terbaik - Harga Murah Februari 2026,"Zhafran Set Couple Bahan Sabrina Terbaru Model Terkini Dan Trendy. Rp235.000 ... Di Tokopedia, kamu bisa menemukan daftar harga Zhafran terbaru Februari 2026 ...",https://www.tokopedia.com/find/zhafran,N/A,,id
2,41.00,D,zhafran terbaru,Fouziah Gous & Zhafran Umum Nikah 21 September Ini,Fouziah-Gous- Zhafran -Umum-Bakal-Nikah-Minggu-Depan. Fouziah Â enggan melayan pandangan orang yang sering berfikiran negatif terhadap rezeki orang lain.,https://www.budiey.com/fouziah-gous-zhafran-umum-nikah-21-september-ini/,N/A,,id
3,41.00,D,zhafran terbaru,Suara latar Zhafran Umar tarik perhatian,KUALA LUMPUR: Suara latar milik si cilik Zhafran Umar Zulfikri Zaki yang berusia tiga tahun dalam video bekal sihatnya mencuit hati pengguna laman sosial.,https://www.bharian.com.my/hujung-minggu/sihat/2022/07/981995/suara-latar-zhafran-umar-tarik-perhatian,N/A,,id
4,40.00,D,zhafran terbaru,Arti Nama Zhafran dan Rekomendasi Rangkaian Nama – TERAKURAT,"Makna Filosofis dari Nama Zhafran . Secara etimologis, Zhafran berasal dari kata Arab yang merujuk pada rempah saffron—rempah mahal dan bernilai tinggi.",https://terakurat.com/arti-nama-zhafran-dan-rekomendasi-rangkaian-nama-2/,2025-08-21,,id
5,39.00,F,zhafran terbaru,"Fouziah Gous, Zhafran Umum Bakal Nikah Minggu Depan","Petang tadi telah berlangsung satu sidang media khas yang di'anjurkan oleh Fouziah Gous dan tunangnya, Md Zhafran untuk mengumumkan tarikh pernikahan.",https://www.rotikaya.com/fouziah-gous-zhafran-umum-bakal-nikah-minggu-depan/,2013-09-13,,id
6,39.00,F,zhafran terbaru,DOA PADA ZHAFRAN | cahayafikir,"Doa pada zhafran . Posted by cahayafikir on Oktober 14, 2011.Di daerah Radio Dalam Jakarta Selatan, bubur zhafran tersebut dihargai 88 ribu satu porsi! selidik punya selidik, zhafran ...",https://cahayafikir.wordpress.com/2011/10/14/doa-pada-zhafran/,2011-10-14,,id
7,38.00,F,zhafran terbaru,Apa Sambungan Nama Zhafran | TikTok,Temukan arti dan kombinasi nama Zhafran untuk anak laki-laki. Dapatkan ide nama bayi unik dan islami di sini!,https://www.tiktok.com/discover/apa-sambungan-nama-zhafran,N/A,,id
8,38.00,F,zhafran terbaru,"35 ide Zhafran | kamar balita, estetika emas, meja akuarium","17 Sep 2023 - Jelajahi papan "" Zhafran "" milik Tasya Sifa di Pinterest. Lihat ide lainnya tentang kamar balita, estetika emas, meja akuarium.",https://tr.pinterest.com/tasyapertiwi16/zhafran/,N/A,,id
9,36.00,F,zhafran terbaru,Fouziah selamat jadi tunangan Zhafran | Awani,"Pelakon tempatan terkenal, Fouziah Gous selamat bertunang dengan jejaka pilihannya, Md Zhafran Md Yusof, malam tadi.",https://www.astroawani.com/berita-hiburan/fouziah-selamat-jadi-tunangan-zhafran-15450,2013-06-02,,id
10,35.00,F,zhafran terbaru,Barang Hafizh Zhafran dijual di Carousell,Lihat daftar mhzhafran27. Lihat di aplikasi Carousell atau unduh aplikasinya sekarang.,https://id.carousell.com/u/mhzhafran27/,N/A,,id
